{
  "kind": "upstream",
  "repository": "https://github.com/op7418/Humanizer-zh",
  "revision": "f4518a8eab97b8bfebc66a89d34320a89bef6930",
  "reviewed_on": "2026-10-16",
  "license": "skills/humanizer-zh/LICENSE",
  "skills": {
    "humanizer-zh": {
      "upstream_path": ".",
      "local_path": "skills/humanizer-zh",
      "adaptations": [
        "Preserve the upstream Chinese body verbatim; retain English discovery and license metadata while omitting client-specific tool restrictions.",
        "Add Codex display metadata while retaining default automatic invocation; shared global guidance owns document-authoring integration and final editorial review."
      ]
    }
  }
}
